{
  "schema_version": "1.0",
  "system": "WizeMe prior gate",
  "status": "complete",
  "dataset": {
    "name": "LoCoMo",
    "variant": "locomo10-e2e-qa-300",
    "revision": "3eb6f2c585f5e1699204e3c3bdf7adc5c28cb376",
    "sha256": "79fa87e90f04081343b8c8debecb80a9a6842b76a7aa537dc9fdf651ea698ff4",
    "kind": "public"
  },
  "evaluation": {
    "task": "answer-quality",
    "mode": "end_to_end_qa",
    "granularity": "question",
    "metric_definition": "Judged answer accuracy produced from retrieved LoCoMo evidence in the WizeMe 300-question QA harness.",
    "evaluator_revision": "wizeme-e2e-qa-harness-2026-06-27"
  },
  "metrics": {
    "query_count": 300,
    "correct": 220,
    "accuracy": 0.7333,
    "official_style_mean": 0.7052,
    "answer_latency_p95_ms": 7524,
    "judge_latency_p95_ms": 1073
  },
  "provenance": {
    "generated_at": "2026-06-27T13:57:12.165Z",
    "source": "WizeMe LoCoMo end-to-end QA harness",
    "command": "Aggregate public receipt; answer and judge configuration retained for controlled review.",
    "hardware": {
      "class": "Windows x64 local evaluation workstation"
    },
    "run_count": 1,
    "aggregate_public_receipt": true,
    "artifact_url": "https://zenodo.org/records/20970433",
    "boundary": "Historical prior scoped 300-question gate. It predates the three-run dual quality lane and is not a same-run control."
  }
}
