{
  "dataset": {
    "kind": "public",
    "name": "LongMemEval",
    "revision": "98d7416c24c778c2fee6e6f3006e7a073259d48f",
    "sha256": "d6f21ea9d60a0d56f34a05b609c79c88a451d2ae03597821ea3d5a9678c3a442",
    "variant": "longmemeval-s-cleaned-turn"
  },
  "evaluation": {
    "evaluator_revision": "9e0b455f4ef0e2ab8f2e582289761153549043fc",
    "granularity": "answer",
    "metric_definition": "Official LongMemEval answer generation plus the unmodified official gpt-4o judge.",
    "mode": "end_to_end_qa",
    "task": "long-term-memory-qa"
  },
  "metrics": {},
  "provenance": {
    "boundary": "This is a matched same-mode placeholder. It is not a score; publish only after the provider writes hypotheses and the pinned official judge runs.",
    "command": "SUPERMEMORY_COMMAND and provider credentials are not configured.",
    "generated_at": "2026-06-23T11:44:20.955109Z",
    "hardware": "Windows-10-10.0.26200-SP0",
    "run_count": 0,
    "source": "scripts/write_pending_longmemeval_provider_qa.py"
  },
  "schema_version": "1.0",
  "status": "not_run",
  "system": "Supermemory"
}
