{
  "schema_version": "1.0",
  "system": "WizeMe",
  "status": "complete",
  "dataset": {
    "name": "LoCoMo",
    "variant": "locomo10-e2e-qa-300",
    "revision": "3eb6f2c585f5e1699204e3c3bdf7adc5c28cb376",
    "sha256": "79fa87e90f04081343b8c8debecb80a9a6842b76a7aa537dc9fdf651ea698ff4",
    "kind": "public"
  },
  "evaluation": {
    "task": "answer-quality",
    "mode": "end_to_end_qa",
    "granularity": "question",
    "metric_definition": "Judged answer accuracy produced from retrieved LoCoMo evidence in the WizeMe 300-question QA harness.",
    "evaluator_revision": "wizeme-e2e-qa-harness-2026-06-27"
  },
  "metrics": {
    "query_count": 300,
    "correct": 251,
    "accuracy": 0.8367,
    "accuracy_range_min": 0.83,
    "accuracy_range_max": 0.84,
    "core_categories_1_to_4_accuracy": 0.873,
    "core_accuracy_range_min": 0.8701,
    "core_accuracy_range_max": 0.8745,
    "adversarial_category_5_accuracy": 0.715,
    "official_style_mean": 0.7083,
    "answer_latency_p95_ms": 14630,
    "judge_latency_p95_ms": 12893
  },
  "provenance": {
    "generated_at": "2026-06-28T02:15:00.000Z",
    "source": "WizeMe LoCoMo end-to-end QA harness",
    "command": "Aggregate public receipt; answer and judge configuration retained for controlled review.",
    "hardware": {
      "class": "Windows x64 local evaluation workstation"
    },
    "run_count": 3,
    "aggregate_public_receipt": true,
    "artifact_url": "https://github.com/zrk222/wizeme-benchmarks/blob/main/results/wizeme-locomo-e2e-stability-3x300.json",
    "boundary": "Three complete 300-question all-category runs. Core Categories 1-4 and adversarial Category 5 are disclosed separately. Not a full-dataset or same-mode provider leaderboard result."
  }
}
